{
    "schema_version": 3,
    "app": "com.example.yourapp",
    "version": "1.2.3",
    "version_code": 10203,
    "captured_at": "2026-01-01",
    "generated_from": {
        "signatures_rev": "0000000"
    },
    "status": "active",
    "sources": [
        {
            "tool": "sigmatcher",
            "config": "signatures/com.example.yourapp/signatures.yaml",
            "classes": 1
        }
    ],
    "classes": {
        "com.example.yourapp.RealClassName": {
            "obfuscated": "a",
            "kind": "class",
            "source": "sigmatcher",
            "anchors": ["a stable string literal in this class"],
            "methods": {
                "realMethodName": {
                    "obfuscated": "b",
                    "signature": "(Ljava/lang/String;)V"
                },
                "overloadedMethod": [
                    { "obfuscated": "c", "signature": "()V" },
                    { "obfuscated": "c", "signature": "(I)V" }
                ]
            },
            "fields": {
                "realFieldName": {
                    "obfuscated": "a",
                    "type": "Ljava/lang/String;"
                }
            }
        }
    }
}
