{
    "schema_version": 3,
    "app": "com.example.app",
    "version": "3.4.5",
    "version_code": 30405,
    "captured_at": "2026-05-01",
    "sources": [
        { "tool": "sigmatcher", "classes": 1 }
    ],
    "classes": {
        "com.example.app.IRemoteService$Stub": {
            "obfuscated": "aaaa",
            "extends": "android.os.Binder",
            "kind": "aidl_stub",
            "aidl_descriptor": "com.example.app.IRemoteService",
            "anchors": [
                "com.example.app.IRemoteService",
                "Transaction failed"
            ],
            "methods": {
                "requestTicket": {
                    "obfuscated": "c",
                    "signature": "(Landroid/os/Bundle;)V",
                    "aidl_txn": 2
                }
            }
        }
    }
}
